<?xml version="1.0" encoding="UTF-8"?>
<xs:schema xmlns:xs="http://www.w3.org/2001/XMLSchema"
           attributeFormDefault="unqualified" elementFormDefault="qualified">
    <xs:element name="root" type="rootType">
    </xs:element>

    <xs:complexType name="rootType">
        <xs:sequence>
            <xs:element name="records" type="recordsType" />
        </xs:sequence>
    </xs:complexType>

    <xs:complexType name="recordsType">
        <xs:sequence>
            <xs:element name="record" type="recordType" maxOccurs="unbounded"
                        minOccurs="0" />
        </xs:sequence>
    </xs:complexType>

    <xs:complexType name="recordType">
        <xs:sequence>
            <xs:element type="xs:string" name="title" minOccurs="0"
                        maxOccurs="1" />
            <xs:element type="xs:string" name="artist" minOccurs="0"
                        maxOccurs="1" />
            <xs:element type="xs:string" name="genre" minOccurs="0"
                        maxOccurs="1" />
            <xs:element type="xs:short" name="year" minOccurs="1"
                        maxOccurs="1" />
        </xs:sequence>
    </xs:complexType>
</xs:schema>